{"$id":"urn:mcpaudit:evidence-conservation:DeterminismProfileV1","$schema":"https://json-schema.org/draft/2020-12/schema","additionalProperties":false,"properties":{"admission_status":{"enum":["CANDIDATE","ADMITTED","REJECTED"]},"body":{"additionalProperties":false,"properties":{"freeze_receipt_ids":{"items":{"minLength":1,"type":"string"},"maxItems":3,"minItems":3,"type":"array"},"preflight_results":{"items":{"additionalProperties":false,"properties":{"profile_id":{"minLength":1,"type":"string"},"reason":{"minLength":1,"type":"string"},"status":{"minLength":1,"type":"string"}},"required":["profile_id","status"],"type":"object"},"maxItems":2,"minItems":2,"type":"array"},"profile_sha256":{"pattern":"^[0-9a-f]{64}$","type":"string"},"profiles":{"items":{"additionalProperties":false,"properties":{"architecture":{"minLength":1,"type":"string"},"canonicalization_exclusions":{"items":{"minLength":1,"type":"string"},"type":"array"},"encoding":{"const":"UTF-8"},"environment_allowlist":{"items":{"minLength":1,"type":"string"},"type":"array"},"filesystem_semantics":{"type":"object"},"fixed_clock":{"minLength":1,"type":"string"},"locale":{"const":"C"},"network_denial":{"minLength":1,"type":"string"},"os":{"minLength":1,"type":"string"},"package_managers":{"type":"object"},"profile_id":{"minLength":1,"type":"string"},"python_hash_seed":{"type":"integer"},"random_seed":{"type":"integer"},"repeat_count":{"const":10},"runtimes":{"type":"object"},"sqlite_version":{"minLength":1,"type":"string"},"subprocess_policy":{"minLength":1,"type":"string"},"timezone":{"const":"UTC"},"writable_roots":{"items":{"minLength":1,"type":"string"},"type":"array"}},"required":["profile_id","os","architecture","runtimes","package_managers","sqlite_version","timezone","locale","encoding","fixed_clock","random_seed","python_hash_seed","environment_allowlist","filesystem_semantics","network_denial","subprocess_policy","writable_roots","canonicalization_exclusions","repeat_count"],"type":"object"},"maxItems":2,"minItems":2,"type":"array"}},"required":["profiles","freeze_receipt_ids","preflight_results","profile_sha256"],"type":"object"},"content_sha256":{"pattern":"^[0-9a-f]{64}$","type":"string"},"created_at_utc":{"minLength":1,"type":"string"},"producer":{"additionalProperties":false,"properties":{"actor_id":{"minLength":1,"type":"string"},"role":{"minLength":1,"type":"string"}},"required":["actor_id","role"],"type":"object"},"record_id":{"minLength":1,"type":"string"},"reviews":{"items":{"additionalProperties":false,"properties":{"decision":{"enum":["ADMIT","REJECT"]},"independent_from":{"items":{"minLength":1,"type":"string"},"type":"array"},"rationale":{"minLength":1,"type":"string"},"reviewed_at_utc":{"minLength":1,"type":"string"},"reviewed_content_sha256":{"pattern":"^[0-9a-f]{64}$","type":"string"},"reviewer_id":{"minLength":1,"type":"string"}},"required":["reviewer_id","independent_from","decision","reviewed_at_utc","reviewed_content_sha256","rationale"],"type":"object"},"type":"array"},"schema":{"const":"DeterminismProfileV1"},"spec_sha256":{"pattern":"^[0-9a-f]{64}$","type":"string"},"supersedes":{"type":["string","null"]}},"required":["schema","record_id","spec_sha256","created_at_utc","producer","supersedes","body","content_sha256","reviews","admission_status"],"type":"object"}
