{"admission_status":"CANDIDATE","body":{"freeze_receipt_ids":["freeze-receipt-p1-v1","freeze-receipt-p2-v1","freeze-receipt-p3-v1"],"preflight_results":[{"profile_id":"darwin-arm64-generator-observed","reason":"local observation is not independent admission","status":"PARTIAL"},{"profile_id":"independent-profile-slot","status":"PENDING_INDEPENDENT_REVIEW"}],"profile_sha256":"e0bf2496e69a5b988167c8362609920e65b243994a3900fd8ea7416f71adba44","profiles":[{"architecture":"arm64","canonicalization_exclusions":["padding","run_id","runtime_timestamp"],"encoding":"UTF-8","environment_allowlist":["LANG","LC_ALL","PATH","PYTHONHASHSEED","TZ"],"filesystem_semantics":{"filesystem":"APFS","posix_private_modes":"OBSERVED_LOCAL_ONLY"},"fixed_clock":"2030-01-02T12:00:00Z","locale":"C","network_denial":"OFFLINE_FLAGS_AND_NO_CONNECTOR_INPUTS","os":"macOS 26.6; Darwin 25.6.0","package_managers":{"cargo":"1.97.1","pnpm":"11.18.0","uv":"0.12.0"},"profile_id":"darwin-arm64-generator-observed","python_hash_seed":0,"random_seed":20260731,"repeat_count":10,"runtimes":{"GithubRepoAuditor":"Python 3.12.13","MCPAudit":"Python 3.11.15","Node":"26.5.0","Rust":"1.97.1","bridge-db":"Python 3.12.13","mcp-trust":"Python 3.12.13"},"sqlite_version":"3.50.4","subprocess_policy":"GENERATOR_AND_VALIDATOR_ONLY; NO_CONSUMERS","timezone":"UTC","writable_roots":["PACKAGE_ROOT","ISOLATED_DISPOSABLE_TEMP"]},{"architecture":"PENDING_INDEPENDENT_REVIEW","canonicalization_exclusions":["padding","run_id","runtime_timestamp"],"encoding":"UTF-8","environment_allowlist":["LANG","LC_ALL","PATH","PYTHONHASHSEED","TZ"],"filesystem_semantics":{"status":"PENDING_INDEPENDENT_REVIEW"},"fixed_clock":"2030-01-02T12:00:00Z","locale":"C","network_denial":"PENDING_INDEPENDENT_REVIEW","os":"PENDING_INDEPENDENT_REVIEW","package_managers":{"status":"PENDING_INDEPENDENT_REVIEW"},"profile_id":"independent-profile-slot","python_hash_seed":0,"random_seed":20260731,"repeat_count":10,"runtimes":{"status":"PENDING_INDEPENDENT_REVIEW"},"sqlite_version":"PENDING_INDEPENDENT_REVIEW","subprocess_policy":"GENERATOR_AND_VALIDATOR_ONLY; NO_CONSUMERS","timezone":"UTC","writable_roots":["PACKAGE_ROOT","ISOLATED_DISPOSABLE_TEMP"]}]},"content_sha256":"f8577c47df4b7549bea93712c607c852779399a9fe7e5ff09321ba9fea7a4171","created_at_utc":"2026-07-31T16:20:00Z","producer":{"actor_id":"codex","role":"EVIDENCE_PACKAGE_GENERATOR"},"record_id":"determinism-profile-v1","reviews":[],"schema":"DeterminismProfileV1","spec_sha256":"711b5c32b053a0e471b9d7e8b0327160d205a8bdfa88f207a921909905afd188","supersedes":null}
